{
  "schema_version": 1,
  "metadata": {
    "toollab_version": "0.1.0",
    "mode": "black",
    "run_id": "903a4a67bfbb4a2597716ab8cc476c818da842bfc09405fef81d6e186c8808f9",
    "run_seed": "42",
    "chaos_seed": "7",
    "started_utc": "2026-02-25T21:02:48Z",
    "finished_utc": "2026-02-25T21:02:48Z"
  },
  "scenario_fingerprint": {
    "scenario_path": "../scenarios/nexus_health.yaml",
    "scenario_sha256": "dcb08f4269edf4d2bc03ed0faa5ea2dc1e1ef045e13538c4c9118dc48e8a987e",
    "scenario_schema_version": 1
  },
  "execution": {
    "schedule_mode": "closed_loop",
    "concurrency": 4,
    "duration_s": 10,
    "planned_requests": 40,
    "completed_requests": 40,
    "decision_engine_version": "splitmix64+xoshiro256ss-v1",
    "decision_tape_hash": "7dc801a69c8cea64c978f6668beb7aeb91b79152e293382a8480a24b6fe7794a"
  },
  "stats": {
    "total_requests": 40,
    "success_rate": 0.975,
    "error_rate": 0.025000000000000022,
    "p50_ms": 25,
    "p95_ms": 50,
    "p99_ms": 51,
    "status_histogram": {
      "200": 39
    }
  },
  "outcomes": [
    {
      "seq": 0,
      "request_id": "readyz",
      "method": "GET",
      "path": "/readyz",
      "status_code": 200,
      "error_kind": "none",
      "latency_ms": 29,
      "response_hash": "4062edaf750fb8074e7e83e0c9028c94e32468a8b6f1614774328ef045150f93",
      "chaos_applied": {
        "latency_injected_ms": 29,
        "error_injected": false,
        "error_mode": "abort",
        "payload_drift_applied": false,
        "payload_mutations": []
      }
    },
    {
      "seq": 1,
      "request_id": "readyz",
      "method": "GET",
      "path": "/readyz",
      "status_code": 200,
      "error_kind": "none",
      "latency_ms": 34,
      "response_hash": "4062edaf750fb8074e7e83e0c9028c94e32468a8b6f1614774328ef045150f93",
      "chaos_applied": {
        "latency_injected_ms": 33,
        "error_injected": false,
        "error_mode": "abort",
        "payload_drift_applied": false,
        "payload_mutations": []
      }
    },
    {
      "seq": 2,
      "request_id": "list_tools",
      "method": "GET",
      "path": "/v1/tools",
      "status_code": 200,
      "error_kind": "none",
      "latency_ms": 21,
      "response_hash": "e938b159f6886267b6a5747015f3b1ceea3e1e1254684a7cc62a7f9e0c7000d5",
      "chaos_applied": {
        "latency_injected_ms": 19,
        "error_injected": false,
        "error_mode": "abort",
        "payload_drift_applied": false,
        "payload_mutations": []
      }
    },
    {
      "seq": 3,
      "request_id": "healthz",
      "method": "GET",
      "path": "/healthz",
      "status_code": 200,
      "error_kind": "none",
      "latency_ms": 41,
      "response_hash": "4062edaf750fb8074e7e83e0c9028c94e32468a8b6f1614774328ef045150f93",
      "chaos_applied": {
        "latency_injected_ms": 41,
        "error_injected": false,
        "error_mode": "abort",
        "payload_drift_applied": false,
        "payload_mutations": []
      }
    },
    {
      "seq": 4,
      "request_id": "audit_feed",
      "method": "GET",
      "path": "/v1/audit",
      "status_code": 200,
      "error_kind": "none",
      "latency_ms": 16,
      "response_hash": "54fb99db88222488d9d9cfda6995037615f8ad6fa251fc616e42cd8e29a06af6",
      "chaos_applied": {
        "latency_injected_ms": 14,
        "error_injected": false,
        "error_mode": "abort",
        "payload_drift_applied": false,
        "payload_mutations": []
      }
    },
    {
      "seq": 5,
      "request_id": "readyz",
      "method": "GET",
      "path": "/readyz",
      "status_code": 200,
      "error_kind": "none",
      "latency_ms": 10,
      "response_hash": "4062edaf750fb8074e7e83e0c9028c94e32468a8b6f1614774328ef045150f93",
      "chaos_applied": {
        "latency_injected_ms": 10,
        "error_injected": false,
        "error_mode": "abort",
        "payload_drift_applied": false,
        "payload_mutations": []
      }
    },
    {
      "seq": 6,
      "request_id": "healthz",
      "method": "GET",
      "path": "/healthz",
      "status_code": 200,
      "error_kind": "none",
      "latency_ms": 25,
      "response_hash": "4062edaf750fb8074e7e83e0c9028c94e32468a8b6f1614774328ef045150f93",
      "chaos_applied": {
        "latency_injected_ms": 24,
        "error_injected": false,
        "error_mode": "abort",
        "payload_drift_applied": false,
        "payload_mutations": []
      }
    },
    {
      "seq": 7,
      "request_id": "healthz",
      "method": "GET",
      "path": "/healthz",
      "status_code": 200,
      "error_kind": "none",
      "latency_ms": 51,
      "response_hash": "4062edaf750fb8074e7e83e0c9028c94e32468a8b6f1614774328ef045150f93",
      "chaos_applied": {
        "latency_injected_ms": 50,
        "error_injected": false,
        "error_mode": "abort",
        "payload_drift_applied": false,
        "payload_mutations": []
      }
    },
    {
      "seq": 8,
      "request_id": "list_tools",
      "method": "GET",
      "path": "/v1/tools",
      "status_code": 200,
      "error_kind": "none",
      "latency_ms": 38,
      "response_hash": "e938b159f6886267b6a5747015f3b1ceea3e1e1254684a7cc62a7f9e0c7000d5",
      "chaos_applied": {
        "latency_injected_ms": 37,
        "error_injected": false,
        "error_mode": "abort",
        "payload_drift_applied": false,
        "payload_mutations": []
      }
    },
    {
      "seq": 9,
      "request_id": "healthz",
      "method": "GET",
      "path": "/healthz",
      "status_code": 200,
      "error_kind": "none",
      "latency_ms": 19,
      "response_hash": "4062edaf750fb8074e7e83e0c9028c94e32468a8b6f1614774328ef045150f93",
      "chaos_applied": {
        "latency_injected_ms": 19,
        "error_injected": false,
        "error_mode": "abort",
        "payload_drift_applied": false,
        "payload_mutations": []
      }
    },
    {
      "seq": 10,
      "request_id": "readyz",
      "method": "GET",
      "path": "/readyz",
      "status_code": 200,
      "error_kind": "none",
      "latency_ms": 7,
      "response_hash": "4062edaf750fb8074e7e83e0c9028c94e32468a8b6f1614774328ef045150f93",
      "chaos_applied": {
        "latency_injected_ms": 7,
        "error_injected": false,
        "error_mode": "abort",
        "payload_drift_applied": false,
        "payload_mutations": []
      }
    },
    {
      "seq": 11,
      "request_id": "readyz",
      "method": "GET",
      "path": "/readyz",
      "status_code": 200,
      "error_kind": "none",
      "latency_ms": 37,
      "response_hash": "4062edaf750fb8074e7e83e0c9028c94e32468a8b6f1614774328ef045150f93",
      "chaos_applied": {
        "latency_injected_ms": 37,
        "error_injected": false,
        "error_mode": "abort",
        "payload_drift_applied": false,
        "payload_mutations": []
      }
    },
    {
      "seq": 12,
      "request_id": "healthz",
      "method": "GET",
      "path": "/healthz",
      "status_code": 200,
      "error_kind": "none",
      "latency_ms": 41,
      "response_hash": "4062edaf750fb8074e7e83e0c9028c94e32468a8b6f1614774328ef045150f93",
      "chaos_applied": {
        "latency_injected_ms": 41,
        "error_injected": false,
        "error_mode": "abort",
        "payload_drift_applied": false,
        "payload_mutations": []
      }
    },
    {
      "seq": 13,
      "request_id": "healthz",
      "method": "GET",
      "path": "/healthz",
      "status_code": 200,
      "error_kind": "none",
      "latency_ms": 28,
      "response_hash": "4062edaf750fb8074e7e83e0c9028c94e32468a8b6f1614774328ef045150f93",
      "chaos_applied": {
        "latency_injected_ms": 27,
        "error_injected": false,
        "error_mode": "abort",
        "payload_drift_applied": false,
        "payload_mutations": []
      }
    },
    {
      "seq": 14,
      "request_id": "healthz",
      "method": "GET",
      "path": "/healthz",
      "status_code": 200,
      "error_kind": "none",
      "latency_ms": 48,
      "response_hash": "4062edaf750fb8074e7e83e0c9028c94e32468a8b6f1614774328ef045150f93",
      "chaos_applied": {
        "latency_injected_ms": 48,
        "error_injected": false,
        "error_mode": "abort",
        "payload_drift_applied": false,
        "payload_mutations": []
      }
    },
    {
      "seq": 15,
      "request_id": "audit_feed",
      "method": "GET",
      "path": "/v1/audit",
      "status_code": 200,
      "error_kind": "none",
      "latency_ms": 6,
      "response_hash": "54fb99db88222488d9d9cfda6995037615f8ad6fa251fc616e42cd8e29a06af6",
      "chaos_applied": {
        "latency_injected_ms": 5,
        "error_injected": false,
        "error_mode": "abort",
        "payload_drift_applied": false,
        "payload_mutations": []
      }
    },
    {
      "seq": 16,
      "request_id": "readyz",
      "method": "GET",
      "path": "/readyz",
      "status_code": 200,
      "error_kind": "none",
      "latency_ms": 29,
      "response_hash": "4062edaf750fb8074e7e83e0c9028c94e32468a8b6f1614774328ef045150f93",
      "chaos_applied": {
        "latency_injected_ms": 29,
        "error_injected": false,
        "error_mode": "abort",
        "payload_drift_applied": false,
        "payload_mutations": []
      }
    },
    {
      "seq": 17,
      "request_id": "readyz",
      "method": "GET",
      "path": "/readyz",
      "status_code": 200,
      "error_kind": "none",
      "latency_ms": 13,
      "response_hash": "4062edaf750fb8074e7e83e0c9028c94e32468a8b6f1614774328ef045150f93",
      "chaos_applied": {
        "latency_injected_ms": 12,
        "error_injected": false,
        "error_mode": "abort",
        "payload_drift_applied": false,
        "payload_mutations": []
      }
    },
    {
      "seq": 18,
      "request_id": "audit_feed",
      "method": "GET",
      "path": "/v1/audit",
      "status_code": 200,
      "error_kind": "none",
      "latency_ms": 21,